name,bigquery_type,description,temporal_coverage,covered_by_dictionary,directory_column,measurement_unit,has_sensitive_data,observations,original_name
year,INT64,Reference year of the ESS round (round start year).,,no,br_bd_diretorios_data_tempo.ano:ano,year,,,essround (derived)
round,INT64,ESS round number (1-11).,,no,,,,,essround
country_id,STRING,Country ISO 3166-1 alpha-2 code (native ESS country identifier).,,no,br_bd_diretorios_mundo.pais:sigla_iso2,,,,cntry
respondent_id,STRING,"Respondent identification number, unique within country and round.",,no,,,,,idno
dataset_title,STRING,Title of dataset,,no,,,no,,name
edition,STRING,Edition,,no,,,no,,edition
production_date,STRING,Production date,,no,,,no,,proddate
tv_watching_total_time_average_weekday,STRING,"TV watching, total time on average weekday",,yes,,,no,,tvtot
tv_watching_news_politics_current_affairs,STRING,"TV watching, news/politics/current affairs on average weekday",,yes,,,no,,tvpol
radio_listening_total_time_average_weekday,STRING,"Radio listening, total time on average weekday",,yes,,,no,,rdtot
radio_listening_news_politics_current_affairs,STRING,"Radio listening, news/politics/current affairs on average weekday",,yes,,,no,,rdpol
newspaper_reading_total_time_average_weekday,STRING,"Newspaper reading, total time on average weekday",,yes,,,no,,nwsptot
newspaper_reading_politics_current_affairs_average,STRING,"Newspaper reading, politics/current affairs on average weekday",,yes,,,no,,nwsppol
personal_use_internet_e_mail_www,STRING,Personal use of internet/e-mail/www,,yes,,,no,,netuse
most_people_can_be_trusted,INT64,Most people can be trusted or you can't be too careful,,no,,,no,,ppltrst
most_people_try_to_be_fair,INT64,"Most people try to take advantage of you, or try to be fair",,no,,,no,,pplfair
most_people_helpful,INT64,Most of the time people helpful or mostly looking out for themselves,,no,,,no,,pplhlp
interest_in_politics,STRING,How interested in politics,,yes,,,no,,polintr
politics_too_complicated_understand,STRING,Politics too complicated to understand,,yes,,,no,,polcmpl
making_mind_up_political_issues,STRING,Making mind up about political issues,,yes,,,no,,poldcs
trust_parliament,INT64,Trust in country's parliament,,no,,,no,,trstprl
trust_legal_system,INT64,Trust in the legal system,,no,,,no,,trstlgl
trust_police,INT64,Trust in the police,,no,,,no,,trstplc
trust_politicians,INT64,Trust in politicians,,no,,,no,,trstplt
trust_political_parties,INT64,Trust in political parties,,no,,,no,,trstprt
trust_european_parliament,INT64,Trust in the European Parliament,,no,,,no,,trstep
trust_united_nations,INT64,Trust in the United Nations,,no,,,no,,trstun
voted_last_national_election,STRING,Voted last national election,,yes,,,no,,vote
party_voted_austria_4,STRING,"Party voted for in last national election, Austria",,yes,,,no,,prtvtaat
party_voted_belgium_5,STRING,"Party voted for in last national election, Belgium",,yes,,,no,,prtvtabe
party_voted_bulgaria_6,STRING,"Party voted for in last national election, Bulgaria",,yes,,,no,,prtvtbg
party_voted_switzerland_8,STRING,"Party voted for in last national election, Switzerland",,yes,,,no,,prtvtach
party_voted_cyprus_4,STRING,"Party voted for in last national election, Cyprus",,yes,,,no,,prtvtcy
party_voted_1_germany_5,STRING,"Party voted for in last national election 1, Germany",,yes,,,no,,prtvbde1
party_voted_2_germany_5,STRING,"Party voted for in last national election 2, Germany",,yes,,,no,,prtvbde2
party_voted_denmark_4,STRING,"Party voted for in last national election, Denmark",,yes,,,no,,prtvtadk
party_voted_estonia_8,STRING,"Party voted for in last national election, Estonia",,yes,,,no,,prtvtaee
party_voted_spain_6,STRING,"Party voted for in last national election, Spain",,yes,,,no,,prtvtaes
party_voted_finland_7,STRING,"Party voted for in last national election, Finland",,yes,,,no,,prtvtfi
party_voted_france_ballot_1_6,STRING,"Party voted for in last national election, France (ballot 1)",,yes,,,no,,prtvtafr
party_voted_united_kingdom_5,STRING,"Party voted for in last national election, United Kingdom",,yes,,,no,,prtvtagb
party_voted_hungary_8,STRING,"Party voted for in last national election, Hungary",,yes,,,no,,prtvtahu
party_voted_ireland_3,STRING,"Party voted for in last national election, Ireland",,yes,,,no,,prtvtie
party_voted_latvia_3,STRING,"Party voted for in last national election, Latvia",,yes,,,no,,prtvtlv
party_voted_netherlands_8,STRING,"Party voted for in last national election, Netherlands",,yes,,,no,,prtvtbnl
party_voted_norway_4,STRING,"Party voted for in last national election, Norway",,yes,,,no,,prtvtno
party_voted_poland_5,STRING,"Party voted for in last national election, Poland",,yes,,,no,,prtvtapl
party_voted_portugal_5,STRING,"Party voted for in last national election, Portugal",,yes,,,no,,prtvtapt
party_voted_romania_2,STRING,"Party voted for in last national election, Romania",,yes,,,no,,prtvtro
party_voted_russian_federation_5,STRING,"Party voted for in last national election, Russian Federation",,yes,,,no,,prtvtru
party_voted_sweden_5,STRING,"Party voted for in last national election, Sweden",,yes,,,no,,prtvtse
party_voted_slovenia_6,STRING,"Party voted for in last national election, Slovenia",,yes,,,no,,prtvtbsi
party_voted_slovakia_5,STRING,"Party voted for in last national election, Slovakia",,yes,,,no,,prtvtask
party_voted_ukraine_2,STRING,"Party voted for in last national election, Ukraine",,yes,,,no,,prtvtaua
contacted_politician,STRING,Contacted politician or government official last 12 months,,yes,,,no,,contplt
worked_political_party_action_group_12_months,STRING,Worked in political party or action group last 12 months,,yes,,,no,,wrkprty
worked_another_organisation_association_12_months,STRING,Worked in another organisation or association last 12 months,,yes,,,no,,wrkorg
worn_campaign_badge,STRING,Worn or displayed campaign badge/sticker last 12 months,,yes,,,no,,badge
signed_petition,STRING,Signed petition last 12 months,,yes,,,no,,sgnptit
taken_part_lawful_public_demonstration_12_months,STRING,Taken part in lawful public demonstration last 12 months,,yes,,,no,,pbldmn
boycotted_products,STRING,Boycotted certain products last 12 months,,yes,,,no,,bctprd
feel_close_to_party,STRING,Feel closer to a particular party than all other parties,,yes,,,no,,clsprty
party_feel_close_austria_4,STRING,"Which party feel closer to, Austria",,yes,,,no,,prtclaat
party_feel_close_belgium_5,STRING,"Which party feel closer to, Belgium",,yes,,,no,,prtclabe
party_feel_close_bulgaria_7,STRING,"Which party feel closer to, Bulgaria",,yes,,,no,,prtclbg
party_feel_close_switzerland_8,STRING,"Which party feel closer to, Switzerland",,yes,,,no,,prtclach
party_feel_close_cyprus_4,STRING,"Which party feel closer to, Cyprus",,yes,,,no,,prtclcy
party_feel_close_germany_5,STRING,"Which party feel closer to, Germany",,yes,,,no,,prtclbde
party_feel_close_denmark_4,STRING,"Which party feel closer to, Denmark",,yes,,,no,,prtcladk
party_feel_close_estonia_8,STRING,"Which party feel closer to, Estonia",,yes,,,no,,prtclaee
party_feel_close_spain_7,STRING,"Which party feel closer to, Spain",,yes,,,no,,prtclaes
party_feel_close_finland_8,STRING,"Which party feel closer to, Finland",,yes,,,no,,prtclfi
party_feel_close_france_7,STRING,"Which party feel closer to, France",,yes,,,no,,prtclafr
party_feel_close_united_kingdom_5,STRING,"Which party feel closer to, United Kingdom",,yes,,,no,,prtclagb
party_feel_close_hungary_9,STRING,"Which party feel closer to, Hungary",,yes,,,no,,prtclahu
party_feel_close_ireland_6,STRING,"Which party feel closer to, Ireland",,yes,,,no,,prtclaie
party_feel_close_latvia_3,STRING,"Which party feel closer to, Latvia",,yes,,,no,,prtcllv
party_feel_close_netherlands_8,STRING,"Which party feel closer to, Netherlands",,yes,,,no,,prtclnl
party_feel_close_norway_4,STRING,"Which party feel closer to, Norway",,yes,,,no,,prtclno
party_feel_close_poland_8,STRING,"Which party feel closer to, Poland",,yes,,,no,,prtclbpl
party_feel_close_portugal_6,STRING,"Which party feel closer to, Portugal",,yes,,,no,,prtclbpt
party_feel_close_romania_2,STRING,"Which party feel closer to, Romania",,yes,,,no,,prtclro
party_feel_close_russian_federation_5,STRING,"Which party feel closer to, Russian Federation",,yes,,,no,,prtclru
party_feel_close_sweden_5,STRING,"Which party feel closer to, Sweden",,yes,,,no,,prtclse
party_feel_close_slovenia_6,STRING,"Which party feel closer to, Slovenia",,yes,,,no,,prtclbsi
party_feel_close_slovakia_5,STRING,"Which party feel closer to, Slovakia",,yes,,,no,,prtclask
party_feel_close_ukraine_4,STRING,"Which party feel closer to, Ukraine",,yes,,,no,,prtclaua
how_close_to_party,STRING,How close to party,,yes,,,no,,prtdgcl
member_political_party,STRING,Member of political party,,yes,,,no,,mmbprty
member_party_austria,STRING,"Member of which party, Austria",,yes,,,no,,prtmbaat
member_party_belgium_3,STRING,"Member of which party, Belgium",,yes,,,no,,prtmbabe
member_party_bulgaria_3,STRING,"Member of which party, Bulgaria",,yes,,,no,,prtmbbg
member_party_switzerland_3,STRING,"Member of which party, Switzerland",,yes,,,no,,prtmbach
member_party_cyprus,STRING,"Member of which party, Cyprus",,yes,,,no,,prtmbcy
member_party_germany_2,STRING,"Member of which party, Germany",,yes,,,no,,prtmbbde
member_party_denmark_2,STRING,"Member of which party, Denmark",,yes,,,no,,prtmbadk
member_party_estonia_3,STRING,"Member of which party, Estonia",,yes,,,no,,prtmbaee
member_party_spain_2,STRING,"Member of which party, Spain",,yes,,,no,,prtmbaes
member_party_finland_3,STRING,"Member of which party, Finland",,yes,,,no,,prtmbfi
member_party_france_3,STRING,"Member of which party, France",,yes,,,no,,prtmbafr
member_party_united_kingdom_2,STRING,"Member of which party, United Kingdom",,yes,,,no,,prtmbagb
member_party_hungary_3,STRING,"Member of which party, Hungary",,yes,,,no,,prtmbahu
member_party_ireland_3,STRING,"Member of which party, Ireland",,yes,,,no,,prtmbie
member_party_latvia,STRING,"Member of which party, Latvia",,yes,,,no,,prtmblv
member_party_netherlands_3,STRING,"Member of which party, Netherlands",,yes,,,no,,prtmbnl
member_party_norway_2,STRING,"Member of which party, Norway",,yes,,,no,,prtmbno
member_party_poland_3,STRING,"Member of which party, Poland",,yes,,,no,,prtmbbpl
member_party_portugal_2,STRING,"Member of which party, Portugal",,yes,,,no,,prtmbapt
member_party_romania_2,STRING,"Member of which party, Romania",,yes,,,no,,prtmbro
member_party_russian_federation_3,STRING,"Member of which party, Russian Federation",,yes,,,no,,prtmbru
member_party_sweden_2,STRING,"Member of which party, Sweden",,yes,,,no,,prtmbse
member_party_slovenia_2,STRING,"Member of which party, Slovenia",,yes,,,no,,prtmbbsi
member_party_slovakia_2,STRING,"Member of which party, Slovakia",,yes,,,no,,prtmbask
member_party_ukraine_3,STRING,"Member of which party, Ukraine",,yes,,,no,,prtmbaua
left_right_scale,INT64,Placement on left right scale,,no,,,no,,lrscale
life_satisfaction,INT64,How satisfied with life as a whole,,no,,,no,,stflife
satisfaction_economy,INT64,How satisfied with present state of economy in country,,no,,,no,,stfeco
satisfaction_government,INT64,How satisfied with the national government,,no,,,no,,stfgov
satisfaction_democracy,INT64,How satisfied with the way democracy works in country,,no,,,no,,stfdem
satisfaction_education,INT64,State of education in country nowadays,,no,,,no,,stfedu
satisfaction_health_services,INT64,State of health services in country nowadays,,no,,,yes,,stfhlth
government_reduce_income_differences,STRING,Government should reduce differences in income levels,,yes,,,yes,,gincdif
gays_free_to_live_as_wish,STRING,Gays and lesbians free to live life as they wish,,yes,,,no,,freehms
ban_political_parties_wish_overthrow_democracy,STRING,Ban political parties that wish overthrow democracy,,yes,,,no,,prtyban
modern_science_can_relied_solve_environmental,STRING,Modern science can be relied on to solve environmental problems,,yes,,,no,,scnsenv
european_unification_go_further,INT64,European Union: European unification go further or gone too far,,no,,,no,,euftf
allow_immigrants_same_ethnicity,STRING,Allow many/few immigrants of same race/ethnic group as majority,,yes,,,yes,,imsmetn
allow_immigrants_different_ethnicity,STRING,Allow many/few immigrants of different race/ethnic group from majority,,yes,,,yes,,imdfetn
allow_immigrants_poorer_countries,STRING,Allow many/few immigrants from poorer countries outside Europe,,yes,,,no,,impcntr
immigration_good_for_economy,INT64,Immigration bad or good for country's economy,,no,,,no,,imbgeco
immigration_undermines_culture,INT64,Country's cultural life undermined or enriched by immigrants,,no,,,no,,imueclt
immigrants_make_country_better,INT64,Immigrants make country worse or better place to live,,no,,,no,,imwbcnt
happiness,INT64,How happy are you,,no,,,no,,happy
frequency_social_meetings,STRING,"How often socially meet with friends, relatives or colleagues",,yes,,,no,,sclmeet
anyone_discuss_intimate_personal_matters,STRING,Anyone to discuss intimate and personal matters with,,yes,,,no,,inmdisc
social_activities_vs_peers,STRING,Take part in social activities compared to others of same age,,yes,,,no,,sclact
victim_of_crime,STRING,Respondent or household member victim of burglary/assault last 5 years,,yes,,,no,,crmvct
feeling_safe_walking_dark,STRING,Feeling of safety of walking alone in local area after dark,,yes,,,no,,aesfdrk
frequency_worry_home_burgled,STRING,How often worry about your home being burgled,,yes,,,no,,brghmwr
worry_home_burgled_has_effect_quality_life,STRING,Worry about home burgled has effect on quality of life,,yes,,,no,,brghmef
frequency_worry_becoming_victim_violent_crime,STRING,How often worry about becoming a victim of violent crime,,yes,,,no,,crvctwr
worry_becoming_victim_violent_crime_has,STRING,Worry about becoming victim of violent crime has effect on quality of life,,yes,,,no,,crvctef
likelihood_terrorist_attack_europe_during_next,STRING,How likely terrorist attack in Europe during next twelve months,,yes,,,no,,trrenyr
likelihood_terrorist_attack_country_during_next,STRING,How likely terrorist attack in country during next twelve months,,yes,,,no,,trrcnyr
terrorist_suspect_prison_until_police_satisfied,STRING,Terrorist suspect in prison until police satisfied,,yes,,,no,,trrprsn
torture_country_never_justified_even_prevent,STRING,Torture in country never justified even to prevent terrorist attack,,yes,,,no,,trrtort
subjective_general_health,STRING,Subjective general health,,yes,,,yes,,health
hampered_by_illness,STRING,Hampered in daily activities by illness/disability/infirmity/mental problem,,yes,,,yes,,hlthhmp
belongs_to_religion,STRING,Belonging to particular religion or denomination,,yes,,,no,,rlgblg
religion_denomination_belonging_present,STRING,Religion or denomination belonging to at present,,yes,,,no,,rlgdnm
ever_belonging_particular_religion_denomination,STRING,Ever belonging to particular religion or denomination,,yes,,,no,,rlgblge
religion_denomination_belonging_past,STRING,Religion or denomination belonging to in the past,,yes,,,no,,rlgdnme
how_religious,INT64,How religious are you,,no,,,no,,rlgdgr
religious_attendance_frequency,STRING,How often attend religious services apart from special occasions,,yes,,,no,,rlgatnd
frequency_of_praying,STRING,How often pray apart from at religious services,,yes,,,no,,pray
member_discriminated_group,STRING,Member of a group discriminated against in this country,,yes,,,no,,dscrgrp
discrimination_group_colour_race,STRING,Discrimination of respondent's group: colour or race,,yes,,,no,,dscrrce
discrimination_group_nationality,STRING,Discrimination of respondent's group: nationality,,yes,,,no,,dscrntn
discrimination_group_religion,STRING,Discrimination of respondent's group: religion,,yes,,,no,,dscrrlg
discrimination_group_language,STRING,Discrimination of respondent's group: language,,yes,,,no,,dscrlng
discrimination_group_ethnic_group,STRING,Discrimination of respondent's group: ethnic group,,yes,,,yes,,dscretn
discrimination_group_age,STRING,Discrimination of respondent's group: age,,yes,,,no,,dscrage
discrimination_group_gender,STRING,Discrimination of respondent's group: gender,,yes,,,no,,dscrgnd
discrimination_group_sexuality,STRING,Discrimination of respondent's group: sexuality,,yes,,,no,,dscrsex
discrimination_group_disability,STRING,Discrimination of respondent's group: disability,,yes,,,no,,dscrdsb
discrimination_group_other_grounds,STRING,Discrimination of respondent's group: other grounds,,yes,,,no,,dscroth
discrimination_group_dont_know,STRING,Discrimination of respondent's group: don't know,,yes,,,no,,dscrdk
discrimination_group_refusal,STRING,Discrimination of respondent's group: refusal,,yes,,,no,,dscrref
discrimination_group_not_applicable,STRING,Discrimination of respondent's group: not applicable,,yes,,,no,,dscrnap
discrimination_group_no_answer,STRING,Discrimination of respondent's group: no answer,,yes,,,no,,dscrna
citizen_of_country,STRING,Citizen of country,,yes,,,no,,ctzcntr
citizenship_4,STRING,Citizenship,,no,,,no,,ctzshipa
born_in_country,STRING,Born in country,,yes,,,no,,brncntr
country_birth_4,STRING,Country of birth,,no,,,no,,cntbrtha
long_ago_first_came_live_country,STRING,How long ago first came to live in country,,yes,,,no,,livecntr
language_home_first_mentioned,STRING,Language most often spoken at home: first mentioned,,no,,,no,,lnghoma
language_home_second_mentioned,STRING,Language most often spoken at home: second mentioned,,no,,,no,,lnghomb
belong_ethnic_minority,STRING,Belong to minority ethnic group in country,,yes,,,yes,,blgetmg
father_born_in_country,STRING,Father born in country,,yes,,,no,,facntr
country_birth_father_4,STRING,"Country of birth, father",,no,,,no,,fbrncnt
mother_born_in_country,STRING,Mother born in country,,yes,,,no,,mocntr
country_birth_mother_4,STRING,"Country of birth, mother",,no,,,no,,mbrncnt
paid_employment_apprenticeship_least_3_months,STRING,Paid employment or apprenticeship at least 3 months 20 hours weekly,,yes,,,no,,evpdemp
year_first_started_paid_employment_apprenticeship,STRING,Year first started in paid employment or apprenticeship,,yes,,,no,,pdempyr
year_first_left_parents_living_separately,STRING,Year first left parents for living separately for 2 months or more,,yes,,,no,,lvpntyr
ever_lived_spouse_partner_3_months_more,STRING,Ever lived with a spouse or partner for 3 months or more,,yes,,,no,,evlvptn
year_first_lived_spouse_partner_3_months_more,STRING,Year first lived with spouse or partner for 3 months or more,,yes,,,no,,lvptnyr
ever_married,STRING,Are or ever been married,,yes,,,no,,evmar
year_first_married,STRING,Year first married,,yes,,,no,,maryr
ever_given_birth_fathered_child,STRING,Ever given birth to/ fathered a child,,yes,,,no,,bthcld
number_children_ever_given_birth_fathered,STRING,Number of children ever given birth to/ fathered,,yes,,,no,,nbthcld
year_first_child_born,STRING,Year (first) child was born,,yes,,,no,,fcldbrn
year_youngest_child_born,STRING,Year youngest child was born,,yes,,,no,,ycldbyr
number_grandchildren,STRING,Number of grandchildren,,yes,,,no,,ngchld
year_first_grandchild_born,STRING,Year first grandchild was born,,yes,,,no,,ygcdbyr
have_any_great_grandchildren,STRING,Have any great grandchildren,,yes,,,no,,ggchld
month_born,STRING,Month born,,yes,,,no,,brnmm
interviewer_code_split_ballot_ask_male_female,STRING,"Interviewer code, split ballot, ask about male or female",,yes,,,no,,icsbfm
age_become_adults_split_ballot,STRING,Age become adults. SPLIT BALLOT,,yes,,,no,,ageadlt
age_reach_middle_age_split_ballot,STRING,Age reach middle age. SPLIT BALLOT,,yes,,,no,,agemage
age_reach_old_age_split_ballot,STRING,Age reach old age. SPLIT BALLOT,,yes,,,no,,ageoage
considered_adult_important_have_left_parental,STRING,"To be considered as adult, how important to have left parental home. SPLIT BALLO",,yes,,,no,,adllvhm
considered_adult_important_have_full_time,STRING,"To be considered as adult, how important to have full-time job. SPLIT BALLOT",,yes,,,no,,adftjob
considered_adult_important_have_lived_spouse,STRING,"To be considered as adult, how important to have lived with spouse, partner. SPL",,yes,,,no,,adlvptn
considered_adult_important_have_become_mother,STRING,"To be considered as adult, how important to have become mother/ father. SPLIT BA",,yes,,,no,,adpnt
considered_old_important_physically_frail_split,STRING,"To be considered as old, how important to be physically frail. SPLIT BALLOT",,yes,,,no,,oldfrl
considered_old_important_grandmother_grandfather_split,STRING,"To be considered as old, how important to be a grandmother/ grandfather. SPLIT B",,yes,,,no,,oldgpnt
considered_old_important_need_others_look,STRING,"To be considered as old, how important to need others look after. SPLIT BALLOT",,yes,,,no,,oldhlpo
start_living_partner_not_married_ideal,STRING,"Start living with partner not married to, ideal age. SPLIT BALLOT",,yes,,,no,,iaglptn
get_married_live_husband_wife_ideal,STRING,"Get married and live with husband/ wife, ideal age. SPLIT BALLOT",,yes,,,no,,iaglvmr
become_mother_father_ideal_age_split_ballot,STRING,"Become mother/ father, ideal age. SPLIT BALLOT",,yes,,,no,,iagpnt
retire_permanently_ideal_age_split_ballot,STRING,"Retire permanently, ideal age. SPLIT BALLOT",,yes,,,no,,iagrtr
leave_full_time_education_age_too,STRING,"Leave full-time education, age too young. SPLIT BALLOT",,yes,,,no,,tygledu
have_sexual_intercourse_age_too_young,STRING,"Have sexual intercourse, age too young. SPLIT BALLOT",,yes,,,yes,,tygsexi
start_living_partner_not_married_age,STRING,"Start living with partner not married to, age too young. SPLIT BALLOT",,yes,,,no,,tyglvp
get_married_live_husband_wife_age,STRING,"Get married and live with husband/ wife, age too young. SPLIT BALLOT",,yes,,,no,,tyglvmr
become_mother_father_age_too_young_split_ballot,STRING,"Become mother/ father, age too young. SPLIT BALLOT",,yes,,,no,,tygpnt
retire_permanently_age_too_young_split_ballot,STRING,"Retire permanently, age too young. SPLIT BALLOT",,yes,,,no,,tygrtr
still_living_parents_age_too_old_split_ballot,STRING,"Still be living with parents, age too old. SPLIT BALLOT",,yes,,,no,,tolvpnt
consider_having_more_children_age_too,STRING,"Consider having more children, age too old. SPLIT BALLOT",,yes,,,no,,tochld
working_20_hours_more_per_week,STRING,"Be working 20 hours or more per week, age too old. SPLIT BALLOT",,yes,,,no,,towkht
approve_if_person_chooses_never_have,STRING,Approve if person chooses never to have children. SPLIT BALLOT,,yes,,,no,,anvcld
approve_if_person_lives_partner_not,STRING,Approve if person lives with partner not married to. SPLIT BALLOT,,yes,,,no,,alvgptn
approve_if_person_have_child_partner,STRING,Approve if person have child with partner not married to. SPLIT BALLOT,,yes,,,no,,acldnmr
approve_if_person_has_full_time,STRING,Approve if person has full-time job while children aged under 3. SPLIT BALLOT,,yes,,,no,,aftjbyc
approve_if_person_gets_divorced_while,STRING,Approve if person gets divorced while children aged under 12. SPLIT BALLOT,,yes,,,no,,advcyc
most_people_react_if_person_became,STRING,Most people react if person became mother/ father before age of 18. SPLIT BALLOT,,yes,,,no,,rpntyng
most_people_react_if_person_carried,STRING,Most people react if person carried on working after age of 70. SPLIT BALLOT,,yes,,,no,,rwkold
most_people_react_if_person_chose,STRING,Most people react if person chose never to have children. SPLIT BALLOT,,yes,,,no,,rnvcld
most_people_react_if_person_lived,STRING,Most people react if person lived with partner not being married to. SPLIT BALLO,,yes,,,no,,rlvgptn
most_people_react_if_person_had,STRING,Most people react if person had child with partner not married to. SPLIT BALLOT,,yes,,,no,,rcldnmr
most_people_react_if_person_had_2,STRING,Most people react if person had full-time job while children aged under 3. SPLIT,,yes,,,no,,rftjbyc
most_people_react_if_person_got,STRING,Most people react if person got divorced while children aged under 12. SPLIT BAL,,yes,,,no,,rdvcyc
plan_future_take_each_day_it_comes,INT64,Plan for future or take each day as it comes,,no,,,no,,plnftr
worried_income_old_age_will_not,INT64,Worried that income in old age will not be adequate to cover later years,,no,,,yes,,wrinco
mainly_responsible_providing_people_adequate_living,INT64,Mainly responsible for providing people adequate living standard when old,,no,,,no,,rspslvo
saving_saved_live_comfortably_old_age,STRING,Saving or saved to live comfortably in old age,,yes,,,no,,svclvo
involved_work_voluntary_charitable_organisations_frequency,STRING,"Involved in work for voluntary or charitable organisations, how often past 12 mo",,yes,,,no,,wkvlorg
help_others_not_counting_family_work,STRING,"Help others not counting family/work/voluntary organisations, how often past 12",,yes,,,no,,hlpoth
help_attend_activities_organised_local_area,STRING,"Help or attend activities organised in local area, how often past 12 months",,yes,,,no,,atnoact
always_optimistic_my_future,STRING,Always optimistic about my future,,yes,,,no,,optftr
general_feel_very_positive_myself,STRING,In general feel very positive about myself,,yes,,,no,,pstvms
times_feel_if_i_am_failure,STRING,At times feel as if I am a failure,,yes,,,no,,flrms
life_close_i_would_like_it,STRING,On the whole life is close to how I would like it to be,,yes,,,no,,lfcllk
felt_depressed_frequency_past_week,STRING,"Felt depressed, how often past week",,yes,,,no,,fltdpr
felt_everything_did_effort_frequency_past_week,STRING,"Felt everything did as effort, how often past week",,yes,,,no,,flteeff
sleep_restless_frequency_past_week,STRING,"Sleep was restless, how often past week",,yes,,,no,,slprl
were_happy_frequency_past_week,STRING,"Were happy, how often past week",,yes,,,no,,wrhpp
felt_lonely_frequency_past_week,STRING,"Felt lonely, how often past week",,yes,,,no,,fltlnl
